web-scraper-order,web-scraper-start-url,Title,Description,Publisher ,Link,Link-href,Stock,Percentage
"1737595881-29","https://finance.yahoo.com/topic/stock-market-news/","Trade War Threatens Canadian Banks Stocks’ Rally After 27% Surge","(Bloomberg) -- The rally in Canadian bank equities is at risk from a potential trade war that would quickly cause a surge in unemployment and loan defaults, analysts at National Bank of Canada said. Most Read from BloombergTexas HOA Charged With Discrimination for Banning Section 8 RentersHow Sanctuary Cities Are Preparing for Another Showdown With TrumpDonations to LA Fire Victims Rise Past $200 Million MarkNY’s Hochul Calls for Law Banning Cell Phone Use in SchoolsLA Schools Wrecked by Fires P","Bloomberg • 8 hours ago","Trade War Threatens Canadian Banks Stocks’ Rally After 27% Surge (Bloomberg) -- The rally in Canadian bank equities is at risk from a potential trade war that would quickly cause a surge in unemployment and loan defaults, analysts at National Bank of Canada said. Most Read from BloombergTexas HOA Charged With Discrimination for Banning Section 8 RentersHow Sanctuary Cities Are Preparing for Another Showdown With TrumpDonations to LA Fire Victims Rise Past $200 Million MarkNY’s Hochul Calls for Law Banning Cell Phone Use in SchoolsLA Schools Wrecked by Fires P","https://finance.yahoo.com/news/trade-war-threatens-canadian-banks-164005752.html","",""
"1737595881-30","https://finance.yahoo.com/topic/stock-market-news/","Netflix Stock Hits All-Time High as Analysts See 'Little Pushback' to Price Hikes","Netflix is entering 2025 “firing on all cylinders” after adding 19 million subscribers in the fourth quarter and raising its subscription prices, JPMorgan analysts said.","Investopedia • 8 hours ago","Netflix Stock Hits All-Time High as Analysts See 'Little Pushback' to Price Hikes Netflix is entering 2025 “firing on all cylinders” after adding 19 million subscribers in the fourth quarter and raising its subscription prices, JPMorgan analysts said.","https://finance.yahoo.com/news/netflix-stock-climbs-analysts-see-163242621.html","NFLX","NFLX"
"1737595881-31","https://finance.yahoo.com/topic/stock-market-news/","Travelers Stock Jumps as Higher Premiums Drive Better-than-Estimated Results","Shares in The Travelers Companies rose in intraday trading Wednesday, as increased premiums drove higher-than-estimated quarterly results at the property and casualty insurer.","Investopedia • 9 hours ago","Travelers Stock Jumps as Higher Premiums Drive Better-than-Estimated Results Shares in The Travelers Companies rose in intraday trading Wednesday, as increased premiums drove higher-than-estimated quarterly results at the property and casualty insurer.","https://finance.yahoo.com/news/travelers-stock-jumps-higher-premiums-162642023.html","TRV","TRV"
"1737595881-32","https://finance.yahoo.com/topic/stock-market-news/","US stocks end higher on blowout Netflix results, strong AI shares. S&P 500 notches record.","Wall Street closed higher, with the S&P 500 index scoring an all-time high. Blowout Netflix results and plans for $500b AI investment fuel gains.","USA TODAY • 3 hours ago","US stocks end higher on blowout Netflix results, strong AI shares. S&P 500 notches record. Wall Street closed higher, with the S&P 500 index scoring an all-time high. Blowout Netflix results and plans for $500b AI investment fuel gains.","https://finance.yahoo.com/news/us-stocks-open-strong-blowout-162314583.html","",""
"1737595881-33","https://finance.yahoo.com/topic/stock-market-news/","Interactive Brokers Stock Hits All-Time High on Trading Volume Jump","Interactive Brokers beat profit and sales forecasts on strong consumer trading volume.","Investopedia • 10 hours ago","Interactive Brokers Stock Hits All-Time High on Trading Volume Jump Interactive Brokers beat profit and sales forecasts on strong consumer trading volume.","https://finance.yahoo.com/news/interactive-brokers-stock-hits-time-152656014.html","IBKR","IBKR"
"1737595881-34","https://finance.yahoo.com/topic/stock-market-news/","Johnson & Johnson stock down despite beat on full-year, Q4 2024 earnings","Johnson & Johnson reported its full year 2024 results, beating Wall Street expectations.","Yahoo Finance • 10 hours ago","Johnson & Johnson stock down despite beat on full-year, Q4 2024 earnings Johnson & Johnson reported its full year 2024 results, beating Wall Street expectations.","https://finance.yahoo.com/news/johnson--johnson-stock-down-despite-beat-on-full-year-q4-2024-earnings-152224387.html","JNJ","JNJ"
"1737595881-35","https://finance.yahoo.com/topic/stock-market-news/","Stocks to Watch Wednesday: Netflix, Oracle, P&G, Microsoft","↗️ Netflix (NFLX): The streaming service posted blockbuster earnings, fueling a surge in its stock Wednesday morning. ↗️ SoftBank (JP:9984, SFTBY): The Japanese conglomerate will co-lead the Stargate joint venture in which tech companies will invest up to $500 billion in U.","The Wall Street Journal • 10 hours ago","Stocks to Watch Wednesday: Netflix, Oracle, P&G, Microsoft ↗️ Netflix (NFLX): The streaming service posted blockbuster earnings, fueling a surge in its stock Wednesday morning. ↗️ SoftBank (JP:9984, SFTBY): The Japanese conglomerate will co-lead the Stargate joint venture in which tech companies will invest up to $500 billion in U.","https://finance.yahoo.com/m/4267910b-8043-3dc0-b0d9-51c3172d1025/stocks-to-watch-wednesday-.html","",""
"1737595881-36","https://finance.yahoo.com/topic/stock-market-news/","Netflix upgraded, Reddit downgraded: Wall Street's top analyst calls","Netflix upgraded, Reddit downgraded: Wall Street's top analyst calls","The Fly • 10 hours ago","Netflix upgraded, Reddit downgraded: Wall Street's top analyst calls Netflix upgraded, Reddit downgraded: Wall Street's top analyst calls","https://finance.yahoo.com/news/netflix-upgraded-reddit-downgraded-wall-143609107.html","NFLX","NFLX   +9.69%"
"1737595881-37","https://finance.yahoo.com/topic/stock-market-news/","Netflix stock hits $1,000 after blockbuster earnings","Netflix (NFLX) stock is booming on Wednesday, a day after the company reported blockbuster earnings bolstered by its largest increase of new paid subscribers ever.","Quartz • 10 hours ago","Netflix stock hits $1,000 after blockbuster earnings Netflix (NFLX) stock is booming on Wednesday, a day after the company reported blockbuster earnings bolstered by its largest increase of new paid subscribers ever.","https://finance.yahoo.com/news/netflix-stock-hits-1-000-143245125.html","NFLX","NFLX   +9.69%"
"1737595881-38","https://finance.yahoo.com/topic/stock-market-news/","JPMorgan’s Dimon Sees Inflated Stocks as ‘Animal Spirits’ Return","(Bloomberg) -- JPMorgan Chase & Co.’s dealmakers are spending their time in the Swiss Alps huddling with ebullient clients, but the boss of the biggest US bank is striking a more cautious tone.Most Read from BloombergTexas HOA Charged With Discrimination for Banning Section 8 RentersHow Sanctuary Cities Are Preparing for Another Showdown With TrumpDonations to LA Fire Victims Rise Past $200 Million MarkNY’s Hochul Calls for Law Banning Cell Phone Use in SchoolsLA Schools Wrecked by Fires Plead o","Bloomberg • 11 hours ago","JPMorgan’s Dimon Sees Inflated Stocks as ‘Animal Spirits’ Return (Bloomberg) -- JPMorgan Chase & Co.’s dealmakers are spending their time in the Swiss Alps huddling with ebullient clients, but the boss of the biggest US bank is striking a more cautious tone.Most Read from BloombergTexas HOA Charged With Discrimination for Banning Section 8 RentersHow Sanctuary Cities Are Preparing for Another Showdown With TrumpDonations to LA Fire Victims Rise Past $200 Million MarkNY’s Hochul Calls for Law Banning Cell Phone Use in SchoolsLA Schools Wrecked by Fires Plead o","https://finance.yahoo.com/news/jpmorgan-dimon-says-us-stock-123412545.html","",""
"1737595881-39","https://finance.yahoo.com/topic/stock-market-news/","Nasdaq CEO on corporate America under Trump: Quieter DEI efforts, exciting IPO environment","Nasdaq chair and CEO Adena Friedman is still a believer in DEI initiatives, and in the IPO market coming back.","Yahoo Finance • 11 hours ago","Nasdaq CEO on corporate America under Trump: Quieter DEI efforts, exciting IPO environment Nasdaq chair and CEO Adena Friedman is still a believer in DEI initiatives, and in the IPO market coming back.","https://finance.yahoo.com/news/nasdaq-ceo-on-corporate-america-under-trump-quieter-dei-efforts-exciting-ipo-environment-133813869.html","JPM","JPM   -0.07%"
"1737595881-40","https://finance.yahoo.com/topic/stock-market-news/","5 Things to Know Before the Stock Market Opens","News of the day for Jan. 22, 2025","Investopedia • 12 hours ago","5 Things to Know Before the Stock Market Opens News of the day for Jan. 22, 2025","https://finance.yahoo.com/news/5-things-know-stock-market-125120333.html","NFLX","NFLX   +9.69%"
"1737595881-41","https://finance.yahoo.com/topic/stock-market-news/","Global industrial, tech stocks rally on Trump's AI investment push","MILAN/PARIS (Reuters) -Global industrial and technology stocks including Oracle and Schneider Electric rallied on Wednesday after U.S. President Donald Trump unveiled a massive artificial intelligence investment push.  Trump on Tuesday announced a private-sector investment of up to $500 billion to fund AI infrastructure, sparking interest in stocks that help build the architecture behind the technology.  French group Schneider Electric, a major supplier of electrical equipment and other infrastructure behind data centers, soared 3.4% to a new high in Paris.","Reuters • 10 hours ago","Global industrial, tech stocks rally on Trump's AI investment push MILAN/PARIS (Reuters) -Global industrial and technology stocks including Oracle and Schneider Electric rallied on Wednesday after U.S. President Donald Trump unveiled a massive artificial intelligence investment push.  Trump on Tuesday announced a private-sector investment of up to $500 billion to fund AI infrastructure, sparking interest in stocks that help build the architecture behind the technology.  French group Schneider Electric, a major supplier of electrical equipment and other infrastructure behind data centers, soared 3.4% to a new high in Paris.","https://finance.yahoo.com/news/europes-industrial-stocks-rally-trumps-124025237.html","PRYMY","PRYMY"
"1737595881-42","https://finance.yahoo.com/topic/stock-market-news/","Barry Callebaut Stock Melts as High Cocoa Prices Weigh on Sales Volume","The chocolate company’s shares fell after it missed sales volume expectations and cut its guidance for fiscal 2025 as soaring cocoa bean prices drag demand.","The Wall Street Journal • 13 hours ago","Barry Callebaut Stock Melts as High Cocoa Prices Weigh on Sales Volume The chocolate company’s shares fell after it missed sales volume expectations and cut its guidance for fiscal 2025 as soaring cocoa bean prices drag demand.","https://finance.yahoo.com/m/bded8d1c-c246-3073-a596-f89198bbfcd2/barry-callebaut-stock-melts.html","",""
"1737595881-43","https://finance.yahoo.com/topic/stock-market-news/","CEO Nicolai Tangen, whose Norway wealth fund owns $173 billion of the Magnificent 7, tells investors to sell U.S. tech stocks","The boss of the $1.8 trillion wealth fund told investors to take a contrarion approach, even if it leads others to questioning your sanity.","Fortune • 13 hours ago","CEO Nicolai Tangen, whose Norway wealth fund owns $173 billion of the Magnificent 7, tells investors to sell U.S. tech stocks The boss of the $1.8 trillion wealth fund told investors to take a contrarion approach, even if it leads others to questioning your sanity.","https://finance.yahoo.com/news/ceo-nicolai-tangen-whose-norway-121224170.html","",""
"1737595881-44","https://finance.yahoo.com/topic/stock-market-news/","The AI trend that could send software stocks soaring in 2025","Palantir and Salesforce have seen their shares soar amid enthusiastic demand for powerful digital assistants and AI platforms.","Fortune • 3 hours ago","The AI trend that could send software stocks soaring in 2025 Palantir and Salesforce have seen their shares soar amid enthusiastic demand for powerful digital assistants and AI platforms.","https://finance.yahoo.com/news/ai-trend-could-send-software-120000440.html","^GSPC","^GSPC   +0.61%"
"1737595881-45","https://finance.yahoo.com/topic/stock-market-news/","GE Vernova Stock Opens at All-Time High as Energy Company Affirms Outlook","GE Vernova shares opened at a new record high Wednesday even though the energy company reported worse-than-expected fourth-quarter results.","Investopedia • 13 hours ago","GE Vernova Stock Opens at All-Time High as Energy Company Affirms Outlook GE Vernova shares opened at a new record high Wednesday even though the energy company reported worse-than-expected fourth-quarter results.","https://finance.yahoo.com/news/ge-vernova-stock-slumps-q4-114137729.html","",""
"1737595881-46","https://finance.yahoo.com/topic/stock-market-news/","Nasdaq 100’s Historic Bull Run Has Further to Go, Evercore Says","(Bloomberg) -- The Nasdaq 100 Index has nearly doubled since the start of 2023, adding $14 trillion in value in the process. Evercore ISI’s Rich Ross is prepared for that rally to continue, shrugging off fears of a familiar nemesis: rising bond yields.Most Read from BloombergTexas HOA Charged With Discrimination for Banning Section 8 RentersHow Sanctuary Cities Are Preparing for Another Showdown With TrumpDonations to LA Fire Victims Rise Past $200 Million MarkNY’s Hochul Calls for Law Banning C","Bloomberg • 14 hours ago","Nasdaq 100’s Historic Bull Run Has Further to Go, Evercore Says (Bloomberg) -- The Nasdaq 100 Index has nearly doubled since the start of 2023, adding $14 trillion in value in the process. Evercore ISI’s Rich Ross is prepared for that rally to continue, shrugging off fears of a familiar nemesis: rising bond yields.Most Read from BloombergTexas HOA Charged With Discrimination for Banning Section 8 RentersHow Sanctuary Cities Are Preparing for Another Showdown With TrumpDonations to LA Fire Victims Rise Past $200 Million MarkNY’s Hochul Calls for Law Banning C","https://finance.yahoo.com/news/nasdaq-100-historic-bull-run-112115708.html","AAPL","AAPL"
"1737595881-47","https://finance.yahoo.com/topic/stock-market-news/","S&P 500 hits record high with boost from Netflix results, AI investment plan","Wall Street's indexes rose on Wednesday, with the benchmark S&P 500 hitting an intraday record high as investors cheered streaming video provider Netflix's quarterly report and President Donald Trump's private-sector artificial intelligence infrastructure investment plan.  The technology sector advanced 2.5% and was the biggest gainer among the S&P 500's 11 major industry indexes with its biggest boosts from AI heavyweights Nvidia and Microsoft.  Netflix , the S&P's biggest gainer, finished up 9.7% after reporting a record number of subscribers for the holiday quarter, enabling it to increase prices for most service plans.","Reuters • 3 hours ago","S&P 500 hits record high with boost from Netflix results, AI investment plan Wall Street's indexes rose on Wednesday, with the benchmark S&P 500 hitting an intraday record high as investors cheered streaming video provider Netflix's quarterly report and President Donald Trump's private-sector artificial intelligence infrastructure investment plan.  The technology sector advanced 2.5% and was the biggest gainer among the S&P 500's 11 major industry indexes with its biggest boosts from AI heavyweights Nvidia and Microsoft.  Netflix , the S&P's biggest gainer, finished up 9.7% after reporting a record number of subscribers for the holiday quarter, enabling it to increase prices for most service plans.","https://finance.yahoo.com/news/nasdaq-futures-lead-gains-netflix-110134068.html","NFLX","NFLX"
"1737595881-48","https://finance.yahoo.com/topic/stock-market-news/","Best money market account rates today, January 22, 2025 (up to 4.75% APY)","Looking for the best money market account interest rates available today? Here’s a look at where to find the highest rates and whether now is a good time to open a money market account.","Yahoo Personal Finance • 14 hours ago","Best money market account rates today, January 22, 2025 (up to 4.75% APY) Looking for the best money market account interest rates available today? Here’s a look at where to find the highest rates and whether now is a good time to open a money market account.","https://finance.yahoo.com/personal-finance/banking/article/money-market-account-rates-today-wednesday-january-22-2025-110018934.html","",""
"1737595881-49","https://finance.yahoo.com/topic/stock-market-news/","China unveils plan to encourage insurance funds into stock markets","China said on Wednesday it will guide big state insurers and commercial insurance funds to increase investments in the A-share market, in a latest move to boost its lagging stock market.  Under a plan jointly released by six financial regulators including the securities regulator, big state-owned insurance companies will be directed to raise both the size and proportion of their investments in Chinese stocks listed on the mainland and equity funds.  The regulators will implement a long-term performance evaluation for state-owned insurance companies, with the annual return on equity weighted no more than 30% of the evaluation, and at least 60% for a longer three-to-five-year cycle.","Reuters • 15 hours ago","China unveils plan to encourage insurance funds into stock markets China said on Wednesday it will guide big state insurers and commercial insurance funds to increase investments in the A-share market, in a latest move to boost its lagging stock market.  Under a plan jointly released by six financial regulators including the securities regulator, big state-owned insurance companies will be directed to raise both the size and proportion of their investments in Chinese stocks listed on the mainland and equity funds.  The regulators will implement a long-term performance evaluation for state-owned insurance companies, with the annual return on equity weighted no more than 30% of the evaluation, and at least 60% for a longer three-to-five-year cycle.","https://finance.yahoo.com/news/china-unveils-plan-encourage-insurance-102420970.html","",""
"1737595881-50","https://finance.yahoo.com/topic/stock-market-news/","China Eases Rules for Long-Term Funds to Boost Stock Market","(Bloomberg) -- China rolled out a basket of measures to stabilize its stock markets, including plans to boost the amount pension can invest in the nation’s listed companies, as it combats uncertainty in a second Donald Trump presidency.Most Read from BloombergTexas HOA Charged With Discrimination for Banning Section 8 RentersHow Sanctuary Cities Are Preparing for Another Showdown With TrumpDonations to LA Fire Victims Rise Past $200 Million MarkNY’s Hochul Calls for Law Banning Cell Phone Use in","Bloomberg • 15 hours ago","China Eases Rules for Long-Term Funds to Boost Stock Market (Bloomberg) -- China rolled out a basket of measures to stabilize its stock markets, including plans to boost the amount pension can invest in the nation’s listed companies, as it combats uncertainty in a second Donald Trump presidency.Most Read from BloombergTexas HOA Charged With Discrimination for Banning Section 8 RentersHow Sanctuary Cities Are Preparing for Another Showdown With TrumpDonations to LA Fire Victims Rise Past $200 Million MarkNY’s Hochul Calls for Law Banning Cell Phone Use in","https://finance.yahoo.com/news/china-eases-rules-long-term-092036967.html","",""
"1737595881-51","https://finance.yahoo.com/topic/stock-market-news/","Indian Stock Exodus Balloons to $5 Billion on Downbeat Profits","(Bloomberg) -- Follow Bloomberg India on WhatsApp for exclusive content and analysis on what billionaires, businesses and markets are doing. Sign up here.Most Read from BloombergTexas HOA Charged With Discrimination for Banning Section 8 RentersHow Sanctuary Cities Are Preparing for Another Showdown With TrumpDonations to LA Fire Victims Rise Past $200 Million MarkNY’s Hochul Calls for Law Banning Cell Phone Use in SchoolsLA Schools Wrecked by Fires Plead on GoFundMe for Help to ReopenStocks in","Bloomberg • 16 hours ago","Indian Stock Exodus Balloons to $5 Billion on Downbeat Profits (Bloomberg) -- Follow Bloomberg India on WhatsApp for exclusive content and analysis on what billionaires, businesses and markets are doing. Sign up here.Most Read from BloombergTexas HOA Charged With Discrimination for Banning Section 8 RentersHow Sanctuary Cities Are Preparing for Another Showdown With TrumpDonations to LA Fire Victims Rise Past $200 Million MarkNY’s Hochul Calls for Law Banning Cell Phone Use in SchoolsLA Schools Wrecked by Fires Plead on GoFundMe for Help to ReopenStocks in","https://finance.yahoo.com/news/indian-stock-exodus-balloons-5-032847054.html","",""
"1737595881-52","https://finance.yahoo.com/topic/stock-market-news/","3 Reasons to Avoid HEES and 1 Stock to Buy Instead","What a fantastic six months it’s been for H&E Equipment Services. Shares of the company have skyrocketed 68.9%, hitting $89.72. This performance may have investors wondering how to approach the situation.","StockStory • 16 hours ago","3 Reasons to Avoid HEES and 1 Stock to Buy Instead What a fantastic six months it’s been for H&E Equipment Services. Shares of the company have skyrocketed 68.9%, hitting $89.72. This performance may have investors wondering how to approach the situation.","https://finance.yahoo.com/news/3-reasons-avoid-hees-1-090641577.html","HEES","HEES"
"1737595881-53","https://finance.yahoo.com/topic/stock-market-news/","3 Reasons to Avoid HBI and 1 Stock to Buy Instead","The past six months have been a windfall for Hanesbrands’s shareholders. The company’s stock price has jumped 58.1%, hitting $8.33 per share. This was partly due to its solid quarterly results, and the performance may have investors wondering how to approach the situation.","StockStory • 16 hours ago","3 Reasons to Avoid HBI and 1 Stock to Buy Instead The past six months have been a windfall for Hanesbrands’s shareholders. The company’s stock price has jumped 58.1%, hitting $8.33 per share. This was partly due to its solid quarterly results, and the performance may have investors wondering how to approach the situation.","https://finance.yahoo.com/news/3-reasons-avoid-hbi-1-090626531.html","HBI","HBI"
"1737595881-54","https://finance.yahoo.com/topic/stock-market-news/","Q3 Earnings Highs And Lows: Generac (NYSE:GNRC) Vs The Rest Of The Renewable Energy Stocks","As the craze of earnings season draws to a close, here’s a look back at some of the most exciting (and some less so) results from Q3. Today, we are looking at renewable energy stocks, starting with Generac (NYSE:GNRC).","StockStory • 16 hours ago","Q3 Earnings Highs And Lows: Generac (NYSE:GNRC) Vs The Rest Of The Renewable Energy Stocks As the craze of earnings season draws to a close, here’s a look back at some of the most exciting (and some less so) results from Q3. Today, we are looking at renewable energy stocks, starting with Generac (NYSE:GNRC).","https://finance.yahoo.com/news/q3-earnings-highs-lows-generac-090625517.html","GNRC","GNRC"
"1737595881-55","https://finance.yahoo.com/topic/stock-market-news/","3 Reasons KO is Risky and 1 Stock to Buy Instead","Coca-Cola has been treading water for the past six months, recording a small loss of 3.5% while holding steady at $62.50. The stock also fell short of the S&P 500’s 9.1% gain during that period.","StockStory • 16 hours ago","3 Reasons KO is Risky and 1 Stock to Buy Instead Coca-Cola has been treading water for the past six months, recording a small loss of 3.5% while holding steady at $62.50. The stock also fell short of the S&P 500’s 9.1% gain during that period.","https://finance.yahoo.com/news/3-reasons-ko-risky-1-090611830.html","KO","KO"
"1737595881-56","https://finance.yahoo.com/topic/stock-market-news/","Processors and Graphics Chips Stocks Q3 Results: Benchmarking Allegro MicroSystems (NASDAQ:ALGM)","Earnings results often indicate what direction a company will take in the months ahead. With Q3 behind us, let’s have a look at Allegro MicroSystems (NASDAQ:ALGM) and its peers.","StockStory • 16 hours ago","Processors and Graphics Chips Stocks Q3 Results: Benchmarking Allegro MicroSystems (NASDAQ:ALGM) Earnings results often indicate what direction a company will take in the months ahead. With Q3 behind us, let’s have a look at Allegro MicroSystems (NASDAQ:ALGM) and its peers.","https://finance.yahoo.com/news/processors-graphics-chips-stocks-q3-090559672.html","ALGM","ALGM"
"1737595881-57","https://finance.yahoo.com/topic/stock-market-news/","Unpacking Q3 Earnings: Shoals (NASDAQ:SHLS) In The Context Of Other Renewable Energy Stocks","The end of the earnings season is always a good time to take a step back and see who shined (and who not so much). Let’s take a look at how renewable energy stocks fared in Q3, starting with Shoals (NASDAQ:SHLS).","StockStory • 16 hours ago","Unpacking Q3 Earnings: Shoals (NASDAQ:SHLS) In The Context Of Other Renewable Energy Stocks The end of the earnings season is always a good time to take a step back and see who shined (and who not so much). Let’s take a look at how renewable energy stocks fared in Q3, starting with Shoals (NASDAQ:SHLS).","https://finance.yahoo.com/news/unpacking-q3-earnings-shoals-nasdaq-090555972.html","SHLS","SHLS"
