web-scraper-order,web-scraper-start-url,Title,Description,Publisher ,Link,Link-href,Stock,Percentage
"1737595881-86","https://finance.yahoo.com/topic/stock-market-news/","Goldman Picks Leaders to Run Wall Street Engines in Revamp","(Bloomberg) -- Goldman Sachs Group Inc. is promoting a slate of star executives to run its biggest Wall Street business lines, spotlighting the firm’s next generation of leadership.Most Read from BloombergTexas HOA Charged With Discrimination for Banning Section 8 RentersHow Sanctuary Cities Are Preparing for Another Showdown With TrumpDonations to LA Fire Victims Rise Past $200 Million MarkNY’s Hochul Calls for Law Banning Cell Phone Use in SchoolsLA Schools Wrecked by Fires Plead on GoFundMe f","Bloomberg • yesterday","Goldman Picks Leaders to Run Wall Street Engines in Revamp (Bloomberg) -- Goldman Sachs Group Inc. is promoting a slate of star executives to run its biggest Wall Street business lines, spotlighting the firm’s next generation of leadership.Most Read from BloombergTexas HOA Charged With Discrimination for Banning Section 8 RentersHow Sanctuary Cities Are Preparing for Another Showdown With TrumpDonations to LA Fire Victims Rise Past $200 Million MarkNY’s Hochul Calls for Law Banning Cell Phone Use in SchoolsLA Schools Wrecked by Fires Plead on GoFundMe f","https://finance.yahoo.com/news/goldman-picks-leaders-run-wall-131507655.html","GSC","GSC"
"1737595881-87","https://finance.yahoo.com/topic/stock-market-news/","Stocks rise as traders closely watch Trump's early tariff moves","Markets rose after Trump's day-one trade policy was softer than feared, with the President holding off on issuing new tariffs via executive order.","Business Insider • yesterday","Stocks rise as traders closely watch Trump's early tariff moves Markets rose after Trump's day-one trade policy was softer than feared, with the President holding off on issuing new tariffs via executive order.","https://finance.yahoo.com/news/stocks-rise-traders-closely-watch-231408017.html","",""
"1737595881-88","https://finance.yahoo.com/topic/stock-market-news/","These Analysts See ‘New Age Opportunities’ Pushing Tesla Stock Toward $500","Tesla remains the “top buy-and-hold” stock for analysts at Piper Sandler, who massively raised their price target for the electric vehicle maker Monday.","Investopedia • yesterday","These Analysts See ‘New Age Opportunities’ Pushing Tesla Stock Toward $500 Tesla remains the “top buy-and-hold” stock for analysts at Piper Sandler, who massively raised their price target for the electric vehicle maker Monday.","https://finance.yahoo.com/news/analysts-see-age-opportunities-pushing-230804106.html","TSLA","TSLA   -2.11%"
"1737595881-89","https://finance.yahoo.com/topic/stock-market-news/","Here's Why This Medical AI Stock Soared 35% on Tuesday","Tempus AI stock had its best day on record on Tuesday after the medical tech company launched an AI-powered health concierge and former House Speaker Nancy Pelosi revealed she's bet on the stock.","Investopedia • yesterday","Here's Why This Medical AI Stock Soared 35% on Tuesday Tempus AI stock had its best day on record on Tuesday after the medical tech company launched an AI-powered health concierge and former House Speaker Nancy Pelosi revealed she's bet on the stock.","https://finance.yahoo.com/news/heres-why-medical-ai-stock-230639424.html","TEM","TEM"
"1737595881-90","https://finance.yahoo.com/topic/stock-market-news/","ESG Roundup: Market Talk","Gain insight on Norway’s sovereign wealth fund, carbon-credit markets and more in the latest Market Talks covering ESG Impact Investing.","The Wall Street Journal • yesterday","ESG Roundup: Market Talk Gain insight on Norway’s sovereign wealth fund, carbon-credit markets and more in the latest Market Talks covering ESG Impact Investing.","https://finance.yahoo.com/m/795e97ca-554a-33c0-9bb6-e429a59ed871/esg-roundup-market-talk.html","",""
"1737595881-91","https://finance.yahoo.com/topic/stock-market-news/","S&P 500 Gains and Losses Today: Walgreens Stock Plummets as DOJ Files Lawsuit","The S&P 500 added 0.9% on Tuesday, Jan. 21, the first day of trading following President Donald Trump's return to the White House.","Investopedia • yesterday","S&P 500 Gains and Losses Today: Walgreens Stock Plummets as DOJ Files Lawsuit The S&P 500 added 0.9% on Tuesday, Jan. 21, the first day of trading following President Donald Trump's return to the White House.","https://finance.yahoo.com/news/p-500-gains-losses-today-221323555.html","^GSPC","^GSPC   +0.61%"
"1737595881-92","https://finance.yahoo.com/topic/stock-market-news/","Luxury, Hotel Stocks Are All the Rage as Tourists Flock to Japan","(Bloomberg) -- Japan’s stock market is only now waking up to potential gains from record numbers of big-spending tourists.Most Read from BloombergTexas HOA Charged With Discrimination for Banning Section 8 RentersHow Sanctuary Cities Are Preparing for Another Showdown With TrumpDonations to LA Fire Victims Rise Past $200 Million MarkNY’s Hochul Calls for Law Banning Cell Phone Use in SchoolsWhat LA’s Fires Mean for the City’s Housing ShortageA growing number of companies, including a seller of v","Bloomberg • yesterday","Luxury, Hotel Stocks Are All the Rage as Tourists Flock to Japan (Bloomberg) -- Japan’s stock market is only now waking up to potential gains from record numbers of big-spending tourists.Most Read from BloombergTexas HOA Charged With Discrimination for Banning Section 8 RentersHow Sanctuary Cities Are Preparing for Another Showdown With TrumpDonations to LA Fire Victims Rise Past $200 Million MarkNY’s Hochul Calls for Law Banning Cell Phone Use in SchoolsWhat LA’s Fires Mean for the City’s Housing ShortageA growing number of companies, including a seller of v","https://finance.yahoo.com/news/luxury-hotel-stocks-rage-tourists-220105590.html","",""
"1737595881-93","https://finance.yahoo.com/topic/stock-market-news/","Stocks Rally on Tariff Delay in Market Mesmerized by Trump","(Bloomberg) -- One trading day into Donald Trump’s second term and it’s clear the stock market has a new driver, at least for now. Share prices rallied Tuesday, with gains largely generated by one thing the president didn’t do: enact sweeping tariffs on major trading partners.Most Read from BloombergTexas HOA Charged With Discrimination for Banning Section 8 RentersHow Sanctuary Cities Are Preparing for Another Showdown With TrumpDonations to LA Fire Victims Rise Past $200 Million MarkNY’s Hochu","Bloomberg • yesterday","Stocks Rally on Tariff Delay in Market Mesmerized by Trump (Bloomberg) -- One trading day into Donald Trump’s second term and it’s clear the stock market has a new driver, at least for now. Share prices rallied Tuesday, with gains largely generated by one thing the president didn’t do: enact sweeping tariffs on major trading partners.Most Read from BloombergTexas HOA Charged With Discrimination for Banning Section 8 RentersHow Sanctuary Cities Are Preparing for Another Showdown With TrumpDonations to LA Fire Victims Rise Past $200 Million MarkNY’s Hochu","https://finance.yahoo.com/news/tesla-slides-space-stocks-soar-181707163.html","TSLA","TSLA   -2.11%"
"1737595881-94","https://finance.yahoo.com/topic/stock-market-news/","How Markets Reacted to Trump's First Day Back in the Oval Office","Stocks advanced, Treasury yields fell and crypto was volatile on Tuesday as market participants reacted to the slew of executive orders issued on the first day of Donald Trump’s second term as president.","Investopedia • yesterday","How Markets Reacted to Trump's First Day Back in the Oval Office Stocks advanced, Treasury yields fell and crypto was volatile on Tuesday as market participants reacted to the slew of executive orders issued on the first day of Donald Trump’s second term as president.","https://finance.yahoo.com/news/markets-reacted-trumps-first-day-214519538.html","",""
"1737595881-95","https://finance.yahoo.com/topic/stock-market-news/","Netflix Stock Pops On Higher Revenue Outlook, $15B Buyback Boost","Netflix reported fourth-quarter results that surpassed analysts’ expectations and raised its 2025 revenue forecast, sending shares soaring after the bell Tuesday.","Investopedia • yesterday","Netflix Stock Pops On Higher Revenue Outlook, $15B Buyback Boost Netflix reported fourth-quarter results that surpassed analysts’ expectations and raised its 2025 revenue forecast, sending shares soaring after the bell Tuesday.","https://finance.yahoo.com/news/netflix-stock-pops-higher-revenue-213737342.html","NFLX","NFLX"
"1737595881-96","https://finance.yahoo.com/topic/stock-market-news/","Agilysys (NASDAQ:AGYS) Misses Q4 Revenue Estimates, Stock Drops 13.4%","Hospitality industry software provider Agilysys (NASDAQ:AGYS) missed Wall Street’s revenue expectations in Q4 CY2024, but sales rose 14.9% year on year to $69.56 million. The company’s full-year revenue guidance of $273 million at the midpoint came in 3.2% below analysts’ estimates. Its non-GAAP profit of $0.38 per share was 10.9% above analysts’ consensus estimates.","StockStory • yesterday","Agilysys (NASDAQ:AGYS) Misses Q4 Revenue Estimates, Stock Drops 13.4% Hospitality industry software provider Agilysys (NASDAQ:AGYS) missed Wall Street’s revenue expectations in Q4 CY2024, but sales rose 14.9% year on year to $69.56 million. The company’s full-year revenue guidance of $273 million at the midpoint came in 3.2% below analysts’ estimates. Its non-GAAP profit of $0.38 per share was 10.9% above analysts’ consensus estimates.","https://finance.yahoo.com/news/agilysys-nasdaq-agys-misses-q4-212942710.html","AGYS","AGYS"
"1737595881-97","https://finance.yahoo.com/topic/stock-market-news/","Netflix Stock Jumps 13% After Price Hike Announced","Shares of Netflix rose 13% in afterhours trading as investors cheered the company's first U.S. price hike since 2023. The streaming service's move aims to capitalize on surging demand and sharp subscriber gains in the fourth quarter.","The Wall Street Journal • yesterday","Netflix Stock Jumps 13% After Price Hike Announced Shares of Netflix rose 13% in afterhours trading as investors cheered the company's first U.S. price hike since 2023. The streaming service's move aims to capitalize on surging demand and sharp subscriber gains in the fourth quarter.","https://finance.yahoo.com/m/3d2f9f40-69ff-38f0-a7b1-00d304f0582c/netflix-stock-jumps-13-after.html","",""
"1737595881-98","https://finance.yahoo.com/topic/stock-market-news/","Stock market winners and losers on Trump’s second day in office","Overall, markets rose, as Trump eased investors’ fears about his line on tariffs.","Fortune • yesterday","Stock market winners and losers on Trump’s second day in office Overall, markets rose, as Trump eased investors’ fears about his line on tariffs.","https://finance.yahoo.com/news/stock-market-winners-losers-trump-212352796.html","NVDA","NVDA"
"1737595881-99","https://finance.yahoo.com/topic/stock-market-news/","Apple Loses Top-Stock Crown as Analysts Downgrade on iPhone Risk","(Bloomberg) -- Apple Inc. received a pair of analyst downgrades, in the latest sign that soft iPhone sales are becoming an increasing concern for investors, as artificial intelligence fails to act as a hoped-for growth catalyst.Most Read from BloombergTexas HOA Charged With Discrimination for Banning Section 8 RentersHow Sanctuary Cities Are Preparing for Another Showdown With TrumpDonations to LA Fire Victims Rise Past $200 Million MarkNY’s Hochul Calls for Law Banning Cell Phone Use in Schools","Bloomberg • yesterday","Apple Loses Top-Stock Crown as Analysts Downgrade on iPhone Risk (Bloomberg) -- Apple Inc. received a pair of analyst downgrades, in the latest sign that soft iPhone sales are becoming an increasing concern for investors, as artificial intelligence fails to act as a hoped-for growth catalyst.Most Read from BloombergTexas HOA Charged With Discrimination for Banning Section 8 RentersHow Sanctuary Cities Are Preparing for Another Showdown With TrumpDonations to LA Fire Victims Rise Past $200 Million MarkNY’s Hochul Calls for Law Banning Cell Phone Use in Schools","https://finance.yahoo.com/news/apple-tough-january-worsens-analysts-143521521.html","AAPL","AAPL"
"1737595881-100","https://finance.yahoo.com/topic/stock-market-news/","Seagate Technology (NASDAQ:STX) Reports Q4 In Line With Expectations But Quarterly Revenue Guidance Significantly Misses Expectations","Data storage manufacturer Seagate (NASDAQ:STX) met Wall Street’s revenue expectations in Q4 CY2024, with sales up 49.5% year on year to $2.33 billion. On the other hand, next quarter’s revenue guidance of $2.1 billion was less impressive, coming in 4.9% below analysts’ estimates. Its non-GAAP profit of $2.03 per share was 8.1% above analysts’ consensus estimates.","StockStory • yesterday","Seagate Technology (NASDAQ:STX) Reports Q4 In Line With Expectations But Quarterly Revenue Guidance Significantly Misses Expectations Data storage manufacturer Seagate (NASDAQ:STX) met Wall Street’s revenue expectations in Q4 CY2024, with sales up 49.5% year on year to $2.33 billion. On the other hand, next quarter’s revenue guidance of $2.1 billion was less impressive, coming in 4.9% below analysts’ estimates. Its non-GAAP profit of $2.03 per share was 8.1% above analysts’ consensus estimates.","https://finance.yahoo.com/news/seagate-technology-nasdaq-stx-reports-212149630.html","STX","STX   +6.84%"
"1737595881-101","https://finance.yahoo.com/topic/stock-market-news/","Netflix (NASDAQ:NFLX) Beats Q4 Sales Targets, Stock Soars","Streaming video giant Netflix (NASDAQ: NFLX) announced better-than-expected revenue in Q4 CY2024, with sales up 16% year on year to $10.25 billion. Revenue guidance for the full year exceeded analysts’ estimates, but next quarter’s guidance of $10.42 billion was less impressive, coming in 0.7% below expectations. Its GAAP profit of $4.27 per share was 1.8% above analysts’ consensus estimates.","StockStory • yesterday","Netflix (NASDAQ:NFLX) Beats Q4 Sales Targets, Stock Soars Streaming video giant Netflix (NASDAQ: NFLX) announced better-than-expected revenue in Q4 CY2024, with sales up 16% year on year to $10.25 billion. Revenue guidance for the full year exceeded analysts’ estimates, but next quarter’s guidance of $10.42 billion was less impressive, coming in 0.7% below expectations. Its GAAP profit of $4.27 per share was 1.8% above analysts’ consensus estimates.","https://finance.yahoo.com/news/netflix-nasdaq-nflx-beats-q4-211447247.html","NFLX","NFLX"
"1737595881-102","https://finance.yahoo.com/topic/stock-market-news/","Apple's China problems keep weighing on the stock","Apple faced two downgrades ahead of earnings, with analysts citing weak iPhone demand. China continues to be a headwind for sales.","Business Insider • yesterday","Apple's China problems keep weighing on the stock Apple faced two downgrades ahead of earnings, with analysts citing weak iPhone demand. China continues to be a headwind for sales.","https://finance.yahoo.com/news/apples-china-problems-keep-weighing-210937085.html","",""
"1737595881-103","https://finance.yahoo.com/topic/stock-market-news/","United Airlines (NASDAQ:UAL) Posts Better-Than-Expected Sales In Q4","Airline company United Airlines Holdings (NASDAQ:UAL) beat Wall Street’s revenue expectations in Q4 CY2024, with sales up 7.8% year on year to $14.7 billion. Its non-GAAP profit of $3.26 per share was 7.7% above analysts’ consensus estimates.","StockStory • yesterday","United Airlines (NASDAQ:UAL) Posts Better-Than-Expected Sales In Q4 Airline company United Airlines Holdings (NASDAQ:UAL) beat Wall Street’s revenue expectations in Q4 CY2024, with sales up 7.8% year on year to $14.7 billion. Its non-GAAP profit of $3.26 per share was 7.7% above analysts’ consensus estimates.","https://finance.yahoo.com/news/united-airlines-nasdaq-ual-posts-210855577.html","UAL","UAL"
"1737595881-104","https://finance.yahoo.com/topic/stock-market-news/","Stocks Get AI Boost as Trump Holds Fire on Tariffs: Markets Wrap","(Bloomberg) -- Stocks climbed as President Donald Trump struck a better-than-feared tone on global trade and speculation grew that his policies will further boost Corporate America. Bonds continued to unwind the recent surge in yields that roiled markets. The dollar wavered.Most Read from BloombergTexas HOA Charged With Discrimination for Banning Section 8 RentersHow Sanctuary Cities Are Preparing for Another Showdown With TrumpDonations to LA Fire Victims Rise Past $200 Million MarkNY’s Hochul","Bloomberg • yesterday","Stocks Get AI Boost as Trump Holds Fire on Tariffs: Markets Wrap (Bloomberg) -- Stocks climbed as President Donald Trump struck a better-than-feared tone on global trade and speculation grew that his policies will further boost Corporate America. Bonds continued to unwind the recent surge in yields that roiled markets. The dollar wavered.Most Read from BloombergTexas HOA Charged With Discrimination for Banning Section 8 RentersHow Sanctuary Cities Are Preparing for Another Showdown With TrumpDonations to LA Fire Victims Rise Past $200 Million MarkNY’s Hochul","https://finance.yahoo.com/news/asian-stocks-set-climb-tariff-222635799.html","^GSPC","^GSPC   +0.61%"
"1737595881-105","https://finance.yahoo.com/topic/stock-market-news/","US stocks rally on Trump’s delayed tariff plan","US stocks closed higher Tuesday after the first full day of Donald Trump’s second presidency, as traders absorbed a blizzard of executive orders that so far point to less aggressive action on trade.","CNN Business • yesterday","US stocks rally on Trump’s delayed tariff plan US stocks closed higher Tuesday after the first full day of Donald Trump’s second presidency, as traders absorbed a blizzard of executive orders that so far point to less aggressive action on trade.","https://finance.yahoo.com/news/us-stocks-rise-trump-delayed-143508857.html","^GSPC","^GSPC   +0.61%"
"1737595881-106","https://finance.yahoo.com/topic/stock-market-news/","Gap (GAP) Stock Trades Up, Here Is Why","Shares of clothing and accessories retailer Gap (NYSE:GAP) jumped 6.4% in the afternoon session after Argus Research analyst Christine Dooley upgraded the stock's rating from Hold to Buy. The analyst cited the potential for a turnaround across key brands (Gap, Banana Republic, Old Navy, and Athleta) while acknowledging management's efforts to ""revitalize the brands.""","StockStory • yesterday","Gap (GAP) Stock Trades Up, Here Is Why Shares of clothing and accessories retailer Gap (NYSE:GAP) jumped 6.4% in the afternoon session after Argus Research analyst Christine Dooley upgraded the stock's rating from Hold to Buy. The analyst cited the potential for a turnaround across key brands (Gap, Banana Republic, Old Navy, and Athleta) while acknowledging management's efforts to ""revitalize the brands.""","https://finance.yahoo.com/news/gap-gap-stock-trades-why-210626575.html","",""
"1737595881-107","https://finance.yahoo.com/topic/stock-market-news/","Oracle stock climbs 7% as Trump is expected to announce its joint AI venture with OpenAI and Softbank","Oracle (ORCL) stock closed up by more than 7% on Tuesday amid reports of a joint venture with OpenAI and Softbank (SFTBY).","Quartz • yesterday","Oracle stock climbs 7% as Trump is expected to announce its joint AI venture with OpenAI and Softbank Oracle (ORCL) stock closed up by more than 7% on Tuesday amid reports of a joint venture with OpenAI and Softbank (SFTBY).","https://finance.yahoo.com/news/oracle-stock-climbs-7-trump-210500186.html","ORCL","ORCL"
"1737595881-108","https://finance.yahoo.com/topic/stock-market-news/","Stock market today: Dow gains 500 points, stocks close near records as Trump holds off on tariffs","Investors are appraising the likely impact of Trump's orders on stocks on the first trading day after the inauguration.","Yahoo Finance • 21 hours ago","Stock market today: Dow gains 500 points, stocks close near records as Trump holds off on tariffs Investors are appraising the likely impact of Trump's orders on stocks on the first trading day after the inauguration.","https://finance.yahoo.com/news/live/stock-market-today-dow-gains-500-points-stocks-close-near-records-as-trump-holds-off-on-tariffs-210210355.html","ES=F","ES=F"
"1737595881-109","https://finance.yahoo.com/topic/stock-market-news/","Why e.l.f. Beauty (ELF) Stock Is Trading Lower Today","Shares of cosmetics company e.l.f. Beauty (NYSE:ELF) fell 5.9% in the afternoon session after research by Morgan Stanley analyst Dara Mohsenian revealed weak sales trends for the company (ELF). The research revealed that U.S. scanner sales growth ""slowed to 5.5% year over year in the last two weeks, including Amazon first party, and were down 1.9% year over year in the last week."" The analyst blamed the weakness partly ""on the timing of the Martin Luther King Jr. Day and the LA wildfires.""","StockStory • yesterday","Why e.l.f. Beauty (ELF) Stock Is Trading Lower Today Shares of cosmetics company e.l.f. Beauty (NYSE:ELF) fell 5.9% in the afternoon session after research by Morgan Stanley analyst Dara Mohsenian revealed weak sales trends for the company (ELF). The research revealed that U.S. scanner sales growth ""slowed to 5.5% year over year in the last two weeks, including Amazon first party, and were down 1.9% year over year in the last week."" The analyst blamed the weakness partly ""on the timing of the Martin Luther King Jr. Day and the LA wildfires.""","https://finance.yahoo.com/news/why-e-l-f-beauty-210127807.html","ELF","ELF"
"1737595881-110","https://finance.yahoo.com/topic/stock-market-news/","Why WillScot Mobile Mini (WSC) Stock Is Trading Up Today","Shares of temporary space provider WillScot (NASDAQ:WSC) jumped 7.2% in the morning session after Semafor reported the company (WSC) is fielding takeover talks from private equity firms. According to the sources, a formal takeover process has likely not started.","StockStory • yesterday","Why WillScot Mobile Mini (WSC) Stock Is Trading Up Today Shares of temporary space provider WillScot (NASDAQ:WSC) jumped 7.2% in the morning session after Semafor reported the company (WSC) is fielding takeover talks from private equity firms. According to the sources, a formal takeover process has likely not started.","https://finance.yahoo.com/news/why-willscot-mobile-mini-wsc-210124293.html","WSC","WSC   +1.58%"
"1737595881-111","https://finance.yahoo.com/topic/stock-market-news/","Why Roku (ROKU) Stock Is Up Today","Shares of streaming TV platform Roku (NASDAQ: ROKU) jumped 7.4% in the afternoon session after JMP initiated coverage on the stock with a Buy rating and a $95 price target. The firm highlighted ROKU's strong position as a ""top streaming platform in the U.S."" and also cited the potential for the company to benefit from increasing ad spend in the connected TV market.","StockStory • yesterday","Why Roku (ROKU) Stock Is Up Today Shares of streaming TV platform Roku (NASDAQ: ROKU) jumped 7.4% in the afternoon session after JMP initiated coverage on the stock with a Buy rating and a $95 price target. The firm highlighted ROKU's strong position as a ""top streaming platform in the U.S."" and also cited the potential for the company to benefit from increasing ad spend in the connected TV market.","https://finance.yahoo.com/news/why-roku-roku-stock-today-210122649.html","ROKU","ROKU"
"1737595881-112","https://finance.yahoo.com/topic/stock-market-news/","DJT Stock Struggles in Early Hours of Trump Presidency","President Trump and Melania Trump now have meme coins, spurring speculative rallies in all kinds of digital assets in recent days.  In their first day of trading since Trump's inauguration Monday, shares of the Truth Social parent have dropped about 11%, trimming their gains for the year to about 4%.","The Wall Street Journal • yesterday","DJT Stock Struggles in Early Hours of Trump Presidency President Trump and Melania Trump now have meme coins, spurring speculative rallies in all kinds of digital assets in recent days.  In their first day of trading since Trump's inauguration Monday, shares of the Truth Social parent have dropped about 11%, trimming their gains for the year to about 4%.","https://finance.yahoo.com/m/fbf677ce-7512-304f-93fe-3e39088ef88b/djt-stock-struggles-in-early.html","",""
"1737595881-113","https://finance.yahoo.com/topic/stock-market-news/","Intel Stock Keeps Climbing Amid Takeover Talk","Shares of Intel were up more than 2% Tuesday afternoon, extending Friday gains that were powered in part by deal-related rumors.","Investopedia • yesterday","Intel Stock Keeps Climbing Amid Takeover Talk Shares of Intel were up more than 2% Tuesday afternoon, extending Friday gains that were powered in part by deal-related rumors.","https://finance.yahoo.com/news/intel-stock-keeps-climbing-amid-202920661.html","INTC","INTC   +0.41%"
