web-scraper-order,web-scraper-start-url,Title,Description,Publisher ,Link,Link-href,Stock,Percentage
"1737595881-58","https://finance.yahoo.com/topic/stock-market-news/","Winners And Losers Of Q3: Health Catalyst (NASDAQ:HCAT) Vs The Rest Of The Data Analytics Stocks","As the Q3 earnings season wraps, let’s dig into this quarter’s best and worst performers in the data analytics industry, including Health Catalyst (NASDAQ:HCAT) and its peers.","StockStory • 16 hours ago","Winners And Losers Of Q3: Health Catalyst (NASDAQ:HCAT) Vs The Rest Of The Data Analytics Stocks As the Q3 earnings season wraps, let’s dig into this quarter’s best and worst performers in the data analytics industry, including Health Catalyst (NASDAQ:HCAT) and its peers.","https://finance.yahoo.com/news/winners-losers-q3-health-catalyst-090518510.html","HCAT","HCAT"
"1737595881-59","https://finance.yahoo.com/topic/stock-market-news/","Spotting Winners: Under Armour (NYSE:UAA) And Apparel and Accessories Stocks In Q3","The end of an earnings season can be a great time to discover new stocks and assess how companies are handling the current business environment. Let’s take a look at how Under Armour (NYSE:UAA) and the rest of the apparel and accessories stocks fared in Q3.","StockStory • 16 hours ago","Spotting Winners: Under Armour (NYSE:UAA) And Apparel and Accessories Stocks In Q3 The end of an earnings season can be a great time to discover new stocks and assess how companies are handling the current business environment. Let’s take a look at how Under Armour (NYSE:UAA) and the rest of the apparel and accessories stocks fared in Q3.","https://finance.yahoo.com/news/spotting-winners-under-armour-nyse-090452082.html","UAA","UAA"
"1737595881-60","https://finance.yahoo.com/topic/stock-market-news/","3 Reasons to Sell BIGC and 1 Stock to Buy Instead","BigCommerce has gotten torched over the last six months - since July 2024, its stock price has dropped 23.4% to $6.13 per share. This might have investors contemplating their next move.","StockStory • 16 hours ago","3 Reasons to Sell BIGC and 1 Stock to Buy Instead BigCommerce has gotten torched over the last six months - since July 2024, its stock price has dropped 23.4% to $6.13 per share. This might have investors contemplating their next move.","https://finance.yahoo.com/news/3-reasons-sell-bigc-1-090451130.html","BIGC","BIGC   +1.14%"
"1737595881-61","https://finance.yahoo.com/topic/stock-market-news/","Winners And Losers Of Q3: Verizon (NYSE:VZ) Vs The Rest Of The Wireless, Cable and Satellite Stocks","As the Q3 earnings season wraps, let’s dig into this quarter’s best and worst performers in the wireless, cable and satellite industry, including Verizon (NYSE:VZ) and its peers.","StockStory • 16 hours ago","Winners And Losers Of Q3: Verizon (NYSE:VZ) Vs The Rest Of The Wireless, Cable and Satellite Stocks As the Q3 earnings season wraps, let’s dig into this quarter’s best and worst performers in the wireless, cable and satellite industry, including Verizon (NYSE:VZ) and its peers.","https://finance.yahoo.com/news/winners-losers-q3-verizon-nyse-090408049.html","VZ","VZ"
"1737595881-62","https://finance.yahoo.com/topic/stock-market-news/","3 Reasons to Avoid YEXT and 1 Stock to Buy Instead","Yext trades at $6.31 per share and has stayed right on track with the overall market, gaining 13.7% over the last six months. At the same time, the S&P 500 has returned 9.1%.","StockStory • 16 hours ago","3 Reasons to Avoid YEXT and 1 Stock to Buy Instead Yext trades at $6.31 per share and has stayed right on track with the overall market, gaining 13.7% over the last six months. At the same time, the S&P 500 has returned 9.1%.","https://finance.yahoo.com/news/3-reasons-avoid-yext-1-090403915.html","YEXT","YEXT"
"1737595881-63","https://finance.yahoo.com/topic/stock-market-news/","Firing on All Cylinders: Matthews (NASDAQ:MATW) Q3 Earnings Lead the Way","Wrapping up Q3 earnings, we look at the numbers and key takeaways for the specialized consumer services stocks, including Matthews (NASDAQ:MATW) and its peers.","StockStory • 16 hours ago","Firing on All Cylinders: Matthews (NASDAQ:MATW) Q3 Earnings Lead the Way Wrapping up Q3 earnings, we look at the numbers and key takeaways for the specialized consumer services stocks, including Matthews (NASDAQ:MATW) and its peers.","https://finance.yahoo.com/news/firing-cylinders-matthews-nasdaq-matw-090351127.html","MATW","MATW"
"1737595881-64","https://finance.yahoo.com/topic/stock-market-news/","Q3 Earnings Highs And Lows: Clarus (NASDAQ:CLAR) Vs The Rest Of The Leisure Products Stocks","Earnings results often indicate what direction a company will take in the months ahead. With Q3 behind us, let’s have a look at Clarus (NASDAQ:CLAR) and its peers.","StockStory • 16 hours ago","Q3 Earnings Highs And Lows: Clarus (NASDAQ:CLAR) Vs The Rest Of The Leisure Products Stocks Earnings results often indicate what direction a company will take in the months ahead. With Q3 behind us, let’s have a look at Clarus (NASDAQ:CLAR) and its peers.","https://finance.yahoo.com/news/q3-earnings-highs-lows-clarus-090322165.html","CLAR","CLAR"
"1737595881-65","https://finance.yahoo.com/topic/stock-market-news/","Sit-Down Dining Stocks Q2 Results: Benchmarking Cracker Barrel (NASDAQ:CBRL)","Let’s dig into the relative performance of Cracker Barrel (NASDAQ:CBRL) and its peers as we unravel the now-completed Q2 sit-down dining earnings season.","StockStory • 16 hours ago","Sit-Down Dining Stocks Q2 Results: Benchmarking Cracker Barrel (NASDAQ:CBRL) Let’s dig into the relative performance of Cracker Barrel (NASDAQ:CBRL) and its peers as we unravel the now-completed Q2 sit-down dining earnings season.","https://finance.yahoo.com/news/sit-down-dining-stocks-q2-090303106.html","CBRL","CBRL"
"1737595881-66","https://finance.yahoo.com/topic/stock-market-news/","Analysis-Azul-Gol airline merger could be a 'necessary evil' in bumpy Brazil market","A plan to merge two of Brazil's top airlines to create a dominant carrier will likely win regulatory approval as a government push for a financially healthy sector outweighs concern about restricted competition, experts and lawyers told Reuters.  A floated combination of Gol and Azul, formalized with a memorandum of understanding last week, would give the new firm overwhelming control over the country's domestic market.  But both have faced financial turbulence since the pandemic, along with Brazil's current No. 1 carrier, LATAM Airlines' local unit.","Reuters • 16 hours ago","Analysis-Azul-Gol airline merger could be a 'necessary evil' in bumpy Brazil market A plan to merge two of Brazil's top airlines to create a dominant carrier will likely win regulatory approval as a government push for a financially healthy sector outweighs concern about restricted competition, experts and lawyers told Reuters.  A floated combination of Gol and Azul, formalized with a memorandum of understanding last week, would give the new firm overwhelming control over the country's domestic market.  But both have faced financial turbulence since the pandemic, along with Brazil's current No. 1 carrier, LATAM Airlines' local unit.","https://finance.yahoo.com/news/analysis-azul-gol-airline-merger-090253959.html","",""
"1737595881-67","https://finance.yahoo.com/topic/stock-market-news/","Winners And Losers Of Q3: Lumen Technologies (NYSE:LUMN) Vs The Rest Of The Wireless, Cable and Satellite Stocks","The end of an earnings season can be a great time to discover new stocks and assess how companies are handling the current business environment. Let’s take a look at how Lumen Technologies (NYSE:LUMN) and the rest of the wireless, cable and satellite stocks fared in Q3.","StockStory • 16 hours ago","Winners And Losers Of Q3: Lumen Technologies (NYSE:LUMN) Vs The Rest Of The Wireless, Cable and Satellite Stocks The end of an earnings season can be a great time to discover new stocks and assess how companies are handling the current business environment. Let’s take a look at how Lumen Technologies (NYSE:LUMN) and the rest of the wireless, cable and satellite stocks fared in Q3.","https://finance.yahoo.com/news/winners-losers-q3-lumen-technologies-090252129.html","LUMN","LUMN"
"1737595881-68","https://finance.yahoo.com/topic/stock-market-news/","Education Services Stocks Q3 Recap: Benchmarking Grand Canyon Education (NASDAQ:LOPE)","Let’s dig into the relative performance of Grand Canyon Education (NASDAQ:LOPE) and its peers as we unravel the now-completed Q3 education services earnings season.","StockStory • 16 hours ago","Education Services Stocks Q3 Recap: Benchmarking Grand Canyon Education (NASDAQ:LOPE) Let’s dig into the relative performance of Grand Canyon Education (NASDAQ:LOPE) and its peers as we unravel the now-completed Q3 education services earnings season.","https://finance.yahoo.com/news/education-services-stocks-q3-recap-090154457.html","LOPE","LOPE"
"1737595881-69","https://finance.yahoo.com/topic/stock-market-news/","Q3 Earnings Highlights: Starbucks (NASDAQ:SBUX) Vs The Rest Of The Traditional Fast Food Stocks","Looking back on traditional fast food stocks’ Q3 earnings, we examine this quarter’s best and worst performers, including Starbucks (NASDAQ:SBUX) and its peers.","StockStory • 16 hours ago","Q3 Earnings Highlights: Starbucks (NASDAQ:SBUX) Vs The Rest Of The Traditional Fast Food Stocks Looking back on traditional fast food stocks’ Q3 earnings, we examine this quarter’s best and worst performers, including Starbucks (NASDAQ:SBUX) and its peers.","https://finance.yahoo.com/news/q3-earnings-highlights-starbucks-nasdaq-090145715.html","SBUX","SBUX"
"1737595881-70","https://finance.yahoo.com/topic/stock-market-news/","Q3 Rundown: Sphere Entertainment (NYSE:SPHR) Vs Other Leisure Facilities Stocks","The end of the earnings season is always a good time to take a step back and see who shined (and who not so much). Let’s take a look at how leisure facilities stocks fared in Q3, starting with Sphere Entertainment (NYSE:SPHR).","StockStory • 16 hours ago","Q3 Rundown: Sphere Entertainment (NYSE:SPHR) Vs Other Leisure Facilities Stocks The end of the earnings season is always a good time to take a step back and see who shined (and who not so much). Let’s take a look at how leisure facilities stocks fared in Q3, starting with Sphere Entertainment (NYSE:SPHR).","https://finance.yahoo.com/news/q3-rundown-sphere-entertainment-nyse-090108344.html","LYV","LYV   -0.27%"
"1737595881-71","https://finance.yahoo.com/topic/stock-market-news/","Q3 Earnings Outperformers: Fastly (NYSE:FSLY) And The Rest Of The Content Delivery Stocks","The end of the earnings season is always a good time to take a step back and see who shined (and who not so much). Let’s take a look at how content delivery stocks fared in Q3, starting with Fastly (NYSE:FSLY).","StockStory • 16 hours ago","Q3 Earnings Outperformers: Fastly (NYSE:FSLY) And The Rest Of The Content Delivery Stocks The end of the earnings season is always a good time to take a step back and see who shined (and who not so much). Let’s take a look at how content delivery stocks fared in Q3, starting with Fastly (NYSE:FSLY).","https://finance.yahoo.com/news/q3-earnings-outperformers-fastly-nyse-090101702.html","FSLY","FSLY"
"1737595881-72","https://finance.yahoo.com/topic/stock-market-news/","STOXX 600 closes at near four-month high as markets brush aside tariff concerns","European stocks closed higher on Wednesday, driven by heavyweight technology and industrial sectors, with markets seeming unfazed by tariff anxieties stirred by recent declarations from U.S. President Donald Trump.  Heavyweight technology stocks <.SX8P> led the charge, rising 1.3%, with technology stocks on Wall Street gaining on upbeat earnings.  Despite Trump's promises to levy new tariffs on the European Union and his threats to impose a 10% tariff on Chinese goods by February 1, the markets remained resilient.","Reuters • 8 hours ago","STOXX 600 closes at near four-month high as markets brush aside tariff concerns European stocks closed higher on Wednesday, driven by heavyweight technology and industrial sectors, with markets seeming unfazed by tariff anxieties stirred by recent declarations from U.S. President Donald Trump.  Heavyweight technology stocks <.SX8P> led the charge, rising 1.3%, with technology stocks on Wall Street gaining on upbeat earnings.  Despite Trump's promises to levy new tariffs on the European Union and his threats to impose a 10% tariff on Chinese goods by February 1, the markets remained resilient.","https://finance.yahoo.com/news/european-stocks-extend-gains-adidas-083905751.html","",""
"1737595881-73","https://finance.yahoo.com/topic/stock-market-news/","Chinese Stocks Halt Four-Day Rally on Trump’s Tariff Warning","(Bloomberg) -- Chinese stocks fell after US President Donald Trump said his threat to impose 10% tariffs on the nation’s goods was still being considered and may take place next month.Most Read from BloombergTexas HOA Charged With Discrimination for Banning Section 8 RentersHow Sanctuary Cities Are Preparing for Another Showdown With TrumpDonations to LA Fire Victims Rise Past $200 Million MarkNY’s Hochul Calls for Law Banning Cell Phone Use in SchoolsLA Schools Wrecked by Fires Plead on GoFundM","Bloomberg • 17 hours ago","Chinese Stocks Halt Four-Day Rally on Trump’s Tariff Warning (Bloomberg) -- Chinese stocks fell after US President Donald Trump said his threat to impose 10% tariffs on the nation’s goods was still being considered and may take place next month.Most Read from BloombergTexas HOA Charged With Discrimination for Banning Section 8 RentersHow Sanctuary Cities Are Preparing for Another Showdown With TrumpDonations to LA Fire Victims Rise Past $200 Million MarkNY’s Hochul Calls for Law Banning Cell Phone Use in SchoolsLA Schools Wrecked by Fires Plead on GoFundM","https://finance.yahoo.com/news/chinese-stocks-fall-trump-says-022921859.html","SLFPF","SLFPF"
"1737595881-74","https://finance.yahoo.com/topic/stock-market-news/","SEC Forms Task Force To Develop Clear Regulations for $3.7 Trillion Cryptocurrency Market","The U.S. Securities and Exchange Commission (SEC) announced the creation of a cryptocurrency task force on Jan. 21, 2025, a day after former Chair Gary Gensler resigned.","CoinMarketCap • 17 hours ago","SEC Forms Task Force To Develop Clear Regulations for $3.7 Trillion Cryptocurrency Market The U.S. Securities and Exchange Commission (SEC) announced the creation of a cryptocurrency task force on Jan. 21, 2025, a day after former Chair Gary Gensler resigned.","https://finance.yahoo.com/news/sec-forms-task-force-develop-081028774.html","",""
"1737595881-75","https://finance.yahoo.com/topic/stock-market-news/","ECB’s Knot Is Content With Market View on Next Two Meetings","(Bloomberg) -- European Central Bank Governing Council member Klaas Knot said investor bets for interest-rate cuts in January and March are reasonable, while any commitment beyond is difficult due to heightened global uncertainty.Most Read from BloombergTexas HOA Charged With Discrimination for Banning Section 8 RentersHow Sanctuary Cities Are Preparing for Another Showdown With TrumpDonations to LA Fire Victims Rise Past $200 Million MarkNY’s Hochul Calls for Law Banning Cell Phone Use in Schoo","Bloomberg • 17 hours ago","ECB’s Knot Is Content With Market View on Next Two Meetings (Bloomberg) -- European Central Bank Governing Council member Klaas Knot said investor bets for interest-rate cuts in January and March are reasonable, while any commitment beyond is difficult due to heightened global uncertainty.Most Read from BloombergTexas HOA Charged With Discrimination for Banning Section 8 RentersHow Sanctuary Cities Are Preparing for Another Showdown With TrumpDonations to LA Fire Victims Rise Past $200 Million MarkNY’s Hochul Calls for Law Banning Cell Phone Use in Schoo","https://finance.yahoo.com/news/ecb-knot-comfortable-market-view-065856446.html","",""
"1737595881-76","https://finance.yahoo.com/topic/stock-market-news/","Oracle surges, chip stocks rise as Trump unveils $500 billion AI plan","(Reuters) -Oracle's shares jumped nearly 9% before the bell on Wednesday after U.S. President Donald Trump said the company would make a large investment in artificial intelligence infrastructure, alongside OpenAI and SoftBank.  The joint venture, called Stargate, plans to invest $500 billion to help the United States stay ahead of China and other rivals in the global AI race, Trump said at the White House on Tuesday.  The venture plans to deploy $100 billion immediately, with the remaining investment over the next four years.","Reuters • 13 hours ago","Oracle surges, chip stocks rise as Trump unveils $500 billion AI plan (Reuters) -Oracle's shares jumped nearly 9% before the bell on Wednesday after U.S. President Donald Trump said the company would make a large investment in artificial intelligence infrastructure, alongside OpenAI and SoftBank.  The joint venture, called Stargate, plans to invest $500 billion to help the United States stay ahead of China and other rivals in the global AI race, Trump said at the White House on Tuesday.  The venture plans to deploy $100 billion immediately, with the remaining investment over the next four years.","https://finance.yahoo.com/news/oracle-shares-rise-9-trump-071809368.html","ORCL","ORCL"
"1737595881-77","https://finance.yahoo.com/topic/stock-market-news/","US stocks climb on Trump AI support, trade outlook","Investors were encouraged by Donald Trump's softer-than-feared tariff announcements as his second term kicked off.","Business Insider • 20 hours ago","US stocks climb on Trump AI support, trade outlook Investors were encouraged by Donald Trump's softer-than-feared tariff announcements as his second term kicked off.","https://finance.yahoo.com/news/us-stocks-climb-trump-ai-051729174.html","",""
"1737595881-78","https://finance.yahoo.com/topic/stock-market-news/","We mistimed the market – but it doesn’t matter for this stock","Antofagasta has provided significant highs and substantial lows since this column first tipped it in August 2021.","The Telegraph • 20 hours ago","We mistimed the market – but it doesn’t matter for this stock Antofagasta has provided significant highs and substantial lows since this column first tipped it in August 2021.","https://finance.yahoo.com/news/mistimed-market-doesn-t-matter-050000004.html","ANFGF","ANFGF"
"1737595881-79","https://finance.yahoo.com/topic/stock-market-news/","Stock market today: Netflix and AI excitement send Wall Street to the brink of an all-time high","Netflix, Oracle and other big technology stocks lifted Wall Street Wednesday as their profits pile higher  and excitement builds  around the moneymaking prospects of artificial intelligence.  The Dow Jones Industrial Average added 130 points, or 0.3%, and the Nasdaq composite climbed 1.3%.  The gains came even though most U.S. stocks fell under the weight of another crank higher for Treasury yields in the bond market.","Associated Press Finance • 4 hours ago","Stock market today: Netflix and AI excitement send Wall Street to the brink of an all-time high Netflix, Oracle and other big technology stocks lifted Wall Street Wednesday as their profits pile higher  and excitement builds  around the moneymaking prospects of artificial intelligence.  The Dow Jones Industrial Average added 130 points, or 0.3%, and the Nasdaq composite climbed 1.3%.  The gains came even though most U.S. stocks fell under the weight of another crank higher for Treasury yields in the bond market.","https://finance.yahoo.com/news/stock-market-today-asian-stocks-045719776.html","",""
"1737595881-80","https://finance.yahoo.com/topic/stock-market-news/","Why a top hedge fund investor says markets under Trump could be more complicated than traders are hoping","Markets hope that Trump's pro-business agenda can unlock more stock gains, but Stanley Druckenmiller says it might be more complicated than that.","Business Insider • 20 hours ago","Why a top hedge fund investor says markets under Trump could be more complicated than traders are hoping Markets hope that Trump's pro-business agenda can unlock more stock gains, but Stanley Druckenmiller says it might be more complicated than that.","https://finance.yahoo.com/news/why-top-hedge-fund-investor-043626542.html","",""
"1737595881-81","https://finance.yahoo.com/topic/stock-market-news/","BOJ Heads Toward Rate Hike as Markets Take Trump in Stride","(Bloomberg) -- Bank of Japan Governor Kazuo Ueda is on track to raise interest rates to the highest level since 2008 on Friday, after global financial markets responded with relative calm to US President Donald Trump’s return to the White House.Most Read from BloombergTexas HOA Charged With Discrimination for Banning Section 8 RentersHow Sanctuary Cities Are Preparing for Another Showdown With TrumpDonations to LA Fire Victims Rise Past $200 Million MarkNY’s Hochul Calls for Law Banning Cell Pho","Bloomberg • 21 hours ago","BOJ Heads Toward Rate Hike as Markets Take Trump in Stride (Bloomberg) -- Bank of Japan Governor Kazuo Ueda is on track to raise interest rates to the highest level since 2008 on Friday, after global financial markets responded with relative calm to US President Donald Trump’s return to the White House.Most Read from BloombergTexas HOA Charged With Discrimination for Banning Section 8 RentersHow Sanctuary Cities Are Preparing for Another Showdown With TrumpDonations to LA Fire Victims Rise Past $200 Million MarkNY’s Hochul Calls for Law Banning Cell Pho","https://finance.yahoo.com/news/boj-heads-toward-rate-hike-014500906.html","",""
"1737595881-82","https://finance.yahoo.com/topic/stock-market-news/","Watch These Netflix Price Levels as Stock Soars After Strong Q4 Earnings","Netflix shares jumped 14% in extended trading Tuesday after the company's results topped Wall Street expectations. Monitor these key chart levels.","Investopedia • 22 hours ago","Watch These Netflix Price Levels as Stock Soars After Strong Q4 Earnings Netflix shares jumped 14% in extended trading Tuesday after the company's results topped Wall Street expectations. Monitor these key chart levels.","https://finance.yahoo.com/news/watch-netflix-price-levels-stock-030205637.html","NFLX","NFLX"
"1737595881-83","https://finance.yahoo.com/topic/stock-market-news/","Dollar flat as market awaits tariff direction, central bank decisions","NEW YORK (Reuters) -The dollar was little changed on Wednesday after earlier dipping to a new two-week low, as investors continued to await concrete announcements about U.S. President Donald Trump's tariff plans.  Trump said late on Tuesday his administration was weighing imposing a 10% tariff on goods imported from China on Feb. 1, after he earlier said Mexico and Canada could face levies of around 25% by Feb. 1.  After hitting a more than two-year high of 110.17 yen last week largely on anticipation of tariffs, the greenback has shown signs of an overcrowded trade reversing on the lack of firm plans from Trump.","Reuters • 5 hours ago","Dollar flat as market awaits tariff direction, central bank decisions NEW YORK (Reuters) -The dollar was little changed on Wednesday after earlier dipping to a new two-week low, as investors continued to await concrete announcements about U.S. President Donald Trump's tariff plans.  Trump said late on Tuesday his administration was weighing imposing a 10% tariff on goods imported from China on Feb. 1, after he earlier said Mexico and Canada could face levies of around 25% by Feb. 1.  After hitting a more than two-year high of 110.17 yen last week largely on anticipation of tariffs, the greenback has shown signs of an overcrowded trade reversing on the lack of firm plans from Trump.","https://finance.yahoo.com/news/dollar-drifts-lower-traders-ponder-014439164.html","",""
"1737595881-84","https://finance.yahoo.com/topic/stock-market-news/","Walgreens Stock Stumbles Amid Legal Challenges, Throwing Cold Water on Hopes for a Rebound","After a tough year for Walgreens investors in 2024, could the stock be poised for a rebound in 2025? Analysts have remained cautious, warning the company still faces several challenges.","Investopedia • yesterday","Walgreens Stock Stumbles Amid Legal Challenges, Throwing Cold Water on Hopes for a Rebound After a tough year for Walgreens investors in 2024, could the stock be poised for a rebound in 2025? Analysts have remained cautious, warning the company still faces several challenges.","https://finance.yahoo.com/news/walgreens-stock-stumbles-amid-legal-004007204.html","WBA","WBA"
"1737595881-85","https://finance.yahoo.com/topic/stock-market-news/","3 big dislocations generating risks for markets right now","Fed rate cuts and Trump's tariff plan are among the things investors may need to adjust their thinking on, Deutsche Bank said.","Business Insider • yesterday","3 big dislocations generating risks for markets right now Fed rate cuts and Trump's tariff plan are among the things investors may need to adjust their thinking on, Deutsche Bank said.","https://finance.yahoo.com/news/3-big-dislocations-generating-risks-002856943.html","",""
