web-scraper-order,web-scraper-start-url,Title,Description,Publisher ,Link,Link-href,Stock,Percentage
"1737595881-1","https://finance.yahoo.com/topic/stock-market-news/","Auto & Transport Roundup: Market Talk","Find insight on Ford, Maersk, EasyJet, Schaeffler and more in the latest Market Talks covering Auto and Transport.","The Wall Street Journal • 3 hours ago","Auto & Transport Roundup: Market Talk Find insight on Ford, Maersk, EasyJet, Schaeffler and more in the latest Market Talks covering Auto and Transport.","https://finance.yahoo.com/m/e18a90aa-6b4c-3f2b-9ac1-a719d0bc424c/auto-transport-roundup-.html","",""
"1737595881-2","https://finance.yahoo.com/topic/stock-market-news/","Financial Services Roundup: Market Talk","Find insight on Capital One, Travelers, Binance and more in the latest Market Talks covering Financial Services.","The Wall Street Journal • 3 hours ago","Financial Services Roundup: Market Talk Find insight on Capital One, Travelers, Binance and more in the latest Market Talks covering Financial Services.","https://finance.yahoo.com/m/bd59c1b5-b6f6-37c2-a111-42d459de8058/financial-services-roundup-.html","",""
"1737595881-3","https://finance.yahoo.com/topic/stock-market-news/","Morning Bid: 'Giddy' Wall Street hits new highs, BOJ looms into view","Whatever doubts investors may have surrounding the longer-term economic damage of U.S. President Donald Trump's proposed tariff agenda, they are giving his deregulation, tech-friendly and AI-supportive policies a huge thumbs up.  With strong earnings from streaming giant Netflix providing an extra tailwind, Wall Street's sizzling performance on Wednesday should fuel a strong rise in risk appetite across Asia on Thursday.  The tech and artificial intelligence fervor is intensifying again after Trump announced a private sector investment of up to $500 billion to fund infrastructure for AI.","Reuters • 3 hours ago","Morning Bid: 'Giddy' Wall Street hits new highs, BOJ looms into view Whatever doubts investors may have surrounding the longer-term economic damage of U.S. President Donald Trump's proposed tariff agenda, they are giving his deregulation, tech-friendly and AI-supportive policies a huge thumbs up.  With strong earnings from streaming giant Netflix providing an extra tailwind, Wall Street's sizzling performance on Wednesday should fuel a strong rise in risk appetite across Asia on Thursday.  The tech and artificial intelligence fervor is intensifying again after Trump announced a private sector investment of up to $500 billion to fund infrastructure for AI.","https://finance.yahoo.com/news/morning-bid-giddy-wall-street-214710994.html","",""
"1737595881-4","https://finance.yahoo.com/topic/stock-market-news/","Saudi Bond Spree Continues as Wealth Fund Taps Dollar Market","(Bloomberg) -- Saudi Arabia’s bond spree continued Wednesday as its sovereign wealth fund sold $4 billion of dollar debt.Most Read from BloombergTexas HOA Charged With Discrimination for Banning Section 8 RentersHow Sanctuary Cities Are Preparing for Another Showdown With TrumpDonations to LA Fire Victims Rise Past $200 Million MarkNY’s Hochul Calls for Law Banning Cell Phone Use in SchoolsLA Schools Wrecked by Fires Plead on GoFundMe for Help to ReopenThe Public Investment Fund priced notes wit","Bloomberg • 3 hours ago","Saudi Bond Spree Continues as Wealth Fund Taps Dollar Market (Bloomberg) -- Saudi Arabia’s bond spree continued Wednesday as its sovereign wealth fund sold $4 billion of dollar debt.Most Read from BloombergTexas HOA Charged With Discrimination for Banning Section 8 RentersHow Sanctuary Cities Are Preparing for Another Showdown With TrumpDonations to LA Fire Victims Rise Past $200 Million MarkNY’s Hochul Calls for Law Banning Cell Phone Use in SchoolsLA Schools Wrecked by Fires Plead on GoFundMe for Help to ReopenThe Public Investment Fund priced notes wit","https://finance.yahoo.com/news/saudi-bond-spree-continues-wealth-162203025.html","",""
"1737595881-5","https://finance.yahoo.com/topic/stock-market-news/","S&P 500 Closes Within Striking Distance of Record: Markets Wrap","(Bloomberg) -- A rally in big tech fueled by optimism over artificial intelligence and a batch of earnings from corporate heavyweights sent stocks to the brink of their all-time highs.Most Read from BloombergTexas HOA Charged With Discrimination for Banning Section 8 RentersHow Sanctuary Cities Are Preparing for Another Showdown With TrumpDonations to LA Fire Victims Rise Past $200 Million MarkNY’s Hochul Calls for Law Banning Cell Phone Use in SchoolsLA Schools Wrecked by Fires Plead on GoFundM","Bloomberg • 3 hours ago","S&P 500 Closes Within Striking Distance of Record: Markets Wrap (Bloomberg) -- A rally in big tech fueled by optimism over artificial intelligence and a batch of earnings from corporate heavyweights sent stocks to the brink of their all-time highs.Most Read from BloombergTexas HOA Charged With Discrimination for Banning Section 8 RentersHow Sanctuary Cities Are Preparing for Another Showdown With TrumpDonations to LA Fire Victims Rise Past $200 Million MarkNY’s Hochul Calls for Law Banning Cell Phone Use in SchoolsLA Schools Wrecked by Fires Plead on GoFundM","https://finance.yahoo.com/news/asia-stocks-set-gain-trump-223617478.html","^RUT","^RUT"
"1737595881-6","https://finance.yahoo.com/topic/stock-market-news/","Knight-Swift Transportation (NYSE:KNX) Slightly Misses Q4 Revenue Estimates, But Stock Soars 5.5%","Freight delivery company Knight-Swift Transportation (NYSE:KNX) fell short of the market’s revenue expectations in Q4 CY2024, with sales falling 3.5% year on year to $1.86 billion. Its non-GAAP profit of $0.36 per share was 10.1% above analysts’ consensus estimates.","StockStory • 3 hours ago","Knight-Swift Transportation (NYSE:KNX) Slightly Misses Q4 Revenue Estimates, But Stock Soars 5.5% Freight delivery company Knight-Swift Transportation (NYSE:KNX) fell short of the market’s revenue expectations in Q4 CY2024, with sales falling 3.5% year on year to $1.86 billion. Its non-GAAP profit of $0.36 per share was 10.1% above analysts’ consensus estimates.","https://finance.yahoo.com/news/knight-swift-transportation-nyse-knx-213135260.html","KNX","KNX"
"1737595881-7","https://finance.yahoo.com/topic/stock-market-news/","Bond Traders Trim Two-Year Futures Bets as Tariff Talk Picks Up","(Bloomberg) -- Bond traders are unwinding bets on two-year Treasury futures as lingering questions around President Donald Trump’s tariff plans cloud the outlook for inflation.Most Read from BloombergTexas HOA Charged With Discrimination for Banning Section 8 RentersHow Sanctuary Cities Are Preparing for Another Showdown With TrumpDonations to LA Fire Victims Rise Past $200 Million MarkNY’s Hochul Calls for Law Banning Cell Phone Use in SchoolsLA Schools Wrecked by Fires Plead on GoFundMe for He","Bloomberg • 4 hours ago","Bond Traders Trim Two-Year Futures Bets as Tariff Talk Picks Up (Bloomberg) -- Bond traders are unwinding bets on two-year Treasury futures as lingering questions around President Donald Trump’s tariff plans cloud the outlook for inflation.Most Read from BloombergTexas HOA Charged With Discrimination for Banning Section 8 RentersHow Sanctuary Cities Are Preparing for Another Showdown With TrumpDonations to LA Fire Victims Rise Past $200 Million MarkNY’s Hochul Calls for Law Banning Cell Phone Use in SchoolsLA Schools Wrecked by Fires Plead on GoFundMe for He","https://finance.yahoo.com/news/bond-traders-trim-two-futures-213000478.html","",""
"1737595881-8","https://finance.yahoo.com/topic/stock-market-news/","Nvidia Overtakes Apple in Stock-Market Value","Nvidia is once again the most valuable U.S. company, outranking Apple for the first time since late November.  A rise in the chip maker's stock meant it ended Tuesday with a market capitalization of $3.","The Wall Street Journal • 4 hours ago","Nvidia Overtakes Apple in Stock-Market Value Nvidia is once again the most valuable U.S. company, outranking Apple for the first time since late November.  A rise in the chip maker's stock meant it ended Tuesday with a market capitalization of $3.","https://finance.yahoo.com/m/1edad139-fdbf-3fd3-9700-582c5e00af67/nvidia-overtakes-apple-in.html","",""
"1737595881-9","https://finance.yahoo.com/topic/stock-market-news/","Netflix stock secures all-time closing high as Wall Street cheers 'near flawless' earnings","Netflix stock is soaring after earnings. Here's what to know.","Yahoo Finance • 4 hours ago","Netflix stock secures all-time closing high as Wall Street cheers 'near flawless' earnings Netflix stock is soaring after earnings. Here's what to know.","https://finance.yahoo.com/news/netflix-stock-secures-all-time-closing-high-as-wall-street-cheers-near-flawless-earnings-212022040.html","NFLX","NFLX"
"1737595881-10","https://finance.yahoo.com/topic/stock-market-news/","Stock market today: Nasdaq jumps, S&P 500 nears record as Netflix, 'Stargate' AI project invigorate tech","President Donald Trump's boost to AI demand hopes is outweighing fresh tariff threats on China and the EU, as earnings season rolls on.","Yahoo Finance • 3 hours ago","Stock market today: Nasdaq jumps, S&P 500 nears record as Netflix, 'Stargate' AI project invigorate tech President Donald Trump's boost to AI demand hopes is outweighing fresh tariff threats on China and the EU, as earnings season rolls on.","https://finance.yahoo.com/news/live/stock-market-today-nasdaq-jumps-sp-500-nears-record-as-netflix-stargate-ai-project-invigorate-tech-210416873.html","NQ=F","NQ=F"
"1737595881-11","https://finance.yahoo.com/topic/stock-market-news/","Why Microsoft (MSFT) Stock Is Trading Up Today","Shares of tech giant Microsoft (NASDAQ:MSFT) jumped 4% in the afternoon session after President Trump announced a $500 billion Stargate project (Joint Venture with OpenAI, Oracle and SoftBank) to develop artificial intelligence infrastructure in the United States. UBS analyst Timothy Arcuri thinks players such as Nvidia would significantly benefit, likely as the supplier of critical semiconductor chips powering some of the anticipated infrastructure requirements, including data centers. As a res","StockStory • 4 hours ago","Why Microsoft (MSFT) Stock Is Trading Up Today Shares of tech giant Microsoft (NASDAQ:MSFT) jumped 4% in the afternoon session after President Trump announced a $500 billion Stargate project (Joint Venture with OpenAI, Oracle and SoftBank) to develop artificial intelligence infrastructure in the United States. UBS analyst Timothy Arcuri thinks players such as Nvidia would significantly benefit, likely as the supplier of critical semiconductor chips powering some of the anticipated infrastructure requirements, including data centers. As a res","https://finance.yahoo.com/news/why-microsoft-msft-stock-trading-204602145.html","MSFT","MSFT"
"1737595881-12","https://finance.yahoo.com/topic/stock-market-news/","U.S. Natural Gas Futures Recover Ahead of Storage Data","U.S. natural gas futures rebounded, closing with a gain of 5.4%, with attention turning to Thursday’s weekly inventory report, which is expected to show a small storage deficit as freezing January weather drives up use.","The Wall Street Journal • 5 hours ago","U.S. Natural Gas Futures Recover Ahead of Storage Data U.S. natural gas futures rebounded, closing with a gain of 5.4%, with attention turning to Thursday’s weekly inventory report, which is expected to show a small storage deficit as freezing January weather drives up use.","https://finance.yahoo.com/m/f35ae80b-2771-3846-9d6a-db9a4f4da4e4/u-s-natural-gas-futures.html","",""
"1737595881-13","https://finance.yahoo.com/topic/stock-market-news/","JPMorgan's Jamie Dimon Says U.S. Stocks Are 'Kind of Inflated'","JPMorgan Chase CEO Jamie Dimon on Wednesday said the U.S. stock market is overvalued and explained why he’s a little more pessimistic about the global economy than your average Wall Street insider.","Investopedia • 6 hours ago","JPMorgan's Jamie Dimon Says U.S. Stocks Are 'Kind of Inflated' JPMorgan Chase CEO Jamie Dimon on Wednesday said the U.S. stock market is overvalued and explained why he’s a little more pessimistic about the global economy than your average Wall Street insider.","https://finance.yahoo.com/news/jpmorgans-jamie-dimon-says-u-185315352.html","",""
"1737595881-14","https://finance.yahoo.com/topic/stock-market-news/","Why Nvidia, Microsoft, Oracle, Arm, and Other AI Stocks Are Surging Wednesday","Shares of Nvidia, Microsoft, Oracle, and other AI-related companies surged Wednesday after the Trump administration’s announcement of a $500 billion joint venture spurred optimism about a rising tide of AI investments.","Investopedia • 6 hours ago","Why Nvidia, Microsoft, Oracle, Arm, and Other AI Stocks Are Surging Wednesday Shares of Nvidia, Microsoft, Oracle, and other AI-related companies surged Wednesday after the Trump administration’s announcement of a $500 billion joint venture spurred optimism about a rising tide of AI investments.","https://finance.yahoo.com/news/why-nvidia-microsoft-oracle-arm-185202591.html","NVDA","NVDA"
"1737595881-15","https://finance.yahoo.com/topic/stock-market-news/","Travelers Notches Record Profit; Insurer’s Stock Rises","Travelers reported record annual profit, reflecting the strong financial run that home and auto insurers are enjoying despite concerns over rate hikes and availability crunches. The insurer didn't put a figure on potential losses from this month’s devastating Los Angeles wildfires.","The Wall Street Journal • 6 hours ago","Travelers Notches Record Profit; Insurer’s Stock Rises Travelers reported record annual profit, reflecting the strong financial run that home and auto insurers are enjoying despite concerns over rate hikes and availability crunches. The insurer didn't put a figure on potential losses from this month’s devastating Los Angeles wildfires.","https://finance.yahoo.com/m/39ed4bf2-ac91-315d-b2dc-7acfaf0ce5dc/travelers-notches-record.html","",""
"1737595881-16","https://finance.yahoo.com/topic/stock-market-news/","Netflix stock jumped 10%—and ads are a big reason why","Advertising revenue doubled this past year, co-CEO Gregory Peters said, and the company expects the same to be true in 2025.","Fortune • 2 hours ago","Netflix stock jumped 10%—and ads are a big reason why Advertising revenue doubled this past year, co-CEO Gregory Peters said, and the company expects the same to be true in 2025.","https://finance.yahoo.com/news/netflix-stock-jumped-10-ads-183929230.html","NFLX","NFLX"
"1737595881-17","https://finance.yahoo.com/topic/stock-market-news/","Watch These Oracle Price Levels as Stock Surges on Optimism About AI Joint Venture","Oracle shares soared following news the enterprise software company will team up with OpenAI and SoftBank to build AI infrastructure. Monitor these crucial chart levels.","Investopedia • 6 hours ago","Watch These Oracle Price Levels as Stock Surges on Optimism About AI Joint Venture Oracle shares soared following news the enterprise software company will team up with OpenAI and SoftBank to build AI infrastructure. Monitor these crucial chart levels.","https://finance.yahoo.com/news/watch-oracle-price-levels-stock-183339639.html","ORCL","ORCL"
"1737595881-18","https://finance.yahoo.com/topic/stock-market-news/","SoftBank, Oracle Stocks Jump After Trump Announces Stargate AI Venture","On Tuesday, the new Trump administration said the companies would be part of Stargate, a $100 billion, AI-focused data-center venture, along with OpenAI and Abu Dhabi’s MGX.  Microsoft, Arm and Nvidia were named Stargate “technology partners.”","The Wall Street Journal • 7 hours ago","SoftBank, Oracle Stocks Jump After Trump Announces Stargate AI Venture On Tuesday, the new Trump administration said the companies would be part of Stargate, a $100 billion, AI-focused data-center venture, along with OpenAI and Abu Dhabi’s MGX.  Microsoft, Arm and Nvidia were named Stargate “technology partners.”","https://finance.yahoo.com/m/752fcffa-124b-3bc5-bed7-9f88b8fbac67/softbank-oracle-stocks-jump.html","",""
"1737595881-19","https://finance.yahoo.com/topic/stock-market-news/","Nvidia, tech stocks rally after Trump announces $500 billion Stargate AI project","Nvidia stock jumped Wednesday, extending gains from the prior day following Trump’s announcement of a massive, $500 billion AI infrastructure project called Stargate. The project will be funded by Oracle, OpenAI and SoftBank.","Yahoo Finance • 4 hours ago","Nvidia, tech stocks rally after Trump announces $500 billion Stargate AI project Nvidia stock jumped Wednesday, extending gains from the prior day following Trump’s announcement of a massive, $500 billion AI infrastructure project called Stargate. The project will be funded by Oracle, OpenAI and SoftBank.","https://finance.yahoo.com/news/nvidia-tech-stocks-rally-after-trump-announces-500-billion-stargate-ai-project-153919780.html","NQ=F","NQ=F"
"1737595881-20","https://finance.yahoo.com/topic/stock-market-news/","Top Stock Movers Now: Netflix, Oracle, Travelers, and More","U.S. equities gained at midday Wednesday on an artificial intelligence initiative announced by the White House and strong earnings reports.","Investopedia • 7 hours ago","Top Stock Movers Now: Netflix, Oracle, Travelers, and More U.S. equities gained at midday Wednesday on an artificial intelligence initiative announced by the White House and strong earnings reports.","https://finance.yahoo.com/news/top-stock-movers-now-netflix-180037696.html","NFLX","NFLX"
"1737595881-21","https://finance.yahoo.com/topic/stock-market-news/","Samsung Set to Enter AR Glasses Market in Race With Meta, Apple","(Bloomberg) -- Samsung Electronics Co. expects to enter the augmented reality glasses market in partnership with Alphabet Inc.’s Google, according to the company’s top mobile executive, jumping into a product category that is suddenly heating up. Most Read from BloombergTexas HOA Charged With Discrimination for Banning Section 8 RentersHow Sanctuary Cities Are Preparing for Another Showdown With TrumpDonations to LA Fire Victims Rise Past $200 Million MarkNY’s Hochul Calls for Law Banning Cell P","Bloomberg • 7 hours ago","Samsung Set to Enter AR Glasses Market in Race With Meta, Apple (Bloomberg) -- Samsung Electronics Co. expects to enter the augmented reality glasses market in partnership with Alphabet Inc.’s Google, according to the company’s top mobile executive, jumping into a product category that is suddenly heating up. Most Read from BloombergTexas HOA Charged With Discrimination for Banning Section 8 RentersHow Sanctuary Cities Are Preparing for Another Showdown With TrumpDonations to LA Fire Victims Rise Past $200 Million MarkNY’s Hochul Calls for Law Banning Cell P","https://finance.yahoo.com/news/samsung-set-enter-ar-glasses-180000759.html","SSNLF","SSNLF"
"1737595881-22","https://finance.yahoo.com/topic/stock-market-news/","The S&P 500 hits a record high as Trump's tariff threats fail to spook markets","Markets moved higher in mid-day trading Wednesday, with the S&P 500 index hitting a new record high on renewed optimism around President Donald Trump’s trade policies.","Quartz • 7 hours ago","The S&P 500 hits a record high as Trump's tariff threats fail to spook markets Markets moved higher in mid-day trading Wednesday, with the S&P 500 index hitting a new record high on renewed optimism around President Donald Trump’s trade policies.","https://finance.yahoo.com/news/p-500-hits-record-high-175000498.html","^GSPC","^GSPC   +0.61%"
"1737595881-23","https://finance.yahoo.com/topic/stock-market-news/","Ally Financial Stock Surges as Company Beats Profit Estimates, Sells Credit Card Business","Ally Financial shares surged Wednesday after the financial firm topped earnings and revenue estimates as it cut costs, and announced it was selling its credit card business.","Investopedia • 7 hours ago","Ally Financial Stock Surges as Company Beats Profit Estimates, Sells Credit Card Business Ally Financial shares surged Wednesday after the financial firm topped earnings and revenue estimates as it cut costs, and announced it was selling its credit card business.","https://finance.yahoo.com/news/ally-financial-stock-surges-company-173217317.html","ALLY","ALLY"
"1737595881-24","https://finance.yahoo.com/topic/stock-market-news/","Early Cancer Detection Firm Grail Leads Nasdaq Gainers as Stock Jumps 20%","Shares of medical technology firm Grail surged 20% to lead Nasdaq 100 winners Wednesday.","Investopedia • 8 hours ago","Early Cancer Detection Firm Grail Leads Nasdaq Gainers as Stock Jumps 20% Shares of medical technology firm Grail surged 20% to lead Nasdaq 100 winners Wednesday.","https://finance.yahoo.com/news/early-cancer-detection-firm-grail-172123163.html","GRAL","GRAL"
"1737595881-25","https://finance.yahoo.com/topic/stock-market-news/","People are buying the wrong stock thinking it's part of OpenAI's Stargate Project","MGX stock is soaring Wednesday on the heels of the company’s involvement with OpenAI and SoftBank’s (SFTBY) new Stargate project. There’s just one minor problem — it’s the stock ticker for the wrong MGX.","Quartz • 8 hours ago","People are buying the wrong stock thinking it's part of OpenAI's Stargate Project MGX stock is soaring Wednesday on the heels of the company’s involvement with OpenAI and SoftBank’s (SFTBY) new Stargate project. There’s just one minor problem — it’s the stock ticker for the wrong MGX.","https://finance.yahoo.com/news/people-buying-wrong-stock-thinking-160000510.html","MGX","MGX"
"1737595881-26","https://finance.yahoo.com/topic/stock-market-news/","Procter & Gamble Stock Gains After Sales Exceed Expectations","Shares of Tide and Pampers parent Procter & Gamble rose Wednesday after the consumer goods giant posted fiscal 2025 second-quarter net sales that topped Wall Street estimates.","Investopedia • 8 hours ago","Procter & Gamble Stock Gains After Sales Exceed Expectations Shares of Tide and Pampers parent Procter & Gamble rose Wednesday after the consumer goods giant posted fiscal 2025 second-quarter net sales that topped Wall Street estimates.","https://finance.yahoo.com/news/procter-gamble-stock-gains-sales-164538327.html","PG","PG"
"1737595881-27","https://finance.yahoo.com/topic/stock-market-news/","Why Teledyne (TDY) Stock Is Trading Up Today","Shares of digital imaging and instrumentation provider Teledyne (NYSE:TDY) jumped 6.9% in the morning session after the company reported fourth-quarter results, which exceeded analysts' revenue and EPS estimates. Sales benefited from acquisitions and improved demand for TDY's unmanned air systems, surveillance systems, and commercial infrared imaging systems. On the other hand, its EPS guidance for next quarter missed, and its full-year EPS guidance fell slightly short of Wall Street's estimates","StockStory • 8 hours ago","Why Teledyne (TDY) Stock Is Trading Up Today Shares of digital imaging and instrumentation provider Teledyne (NYSE:TDY) jumped 6.9% in the morning session after the company reported fourth-quarter results, which exceeded analysts' revenue and EPS estimates. Sales benefited from acquisitions and improved demand for TDY's unmanned air systems, surveillance systems, and commercial infrared imaging systems. On the other hand, its EPS guidance for next quarter missed, and its full-year EPS guidance fell slightly short of Wall Street's estimates","https://finance.yahoo.com/news/why-teledyne-tdy-stock-trading-164411818.html","TDY","TDY"
"1737595881-28","https://finance.yahoo.com/topic/stock-market-news/","Netflix (NFLX) Stock Trades Up, Here Is Why","Shares of streaming video giant Netflix (NASDAQ: NFLX) jumped 15.4% in the pre-market session after the company reported impressive fourth-quarter results, which blew past analysts' global streaming paid memberships expectations, with a strong net add figure (18.9 million vs. estimates of 9.8 million). This led to a revenue and EPS beat in the quarter. Additionally, revenue guidance for 2025 beat expectations, and the company spoke optimistically about multiple vectors such as ad revenue, live e","StockStory • 8 hours ago","Netflix (NFLX) Stock Trades Up, Here Is Why Shares of streaming video giant Netflix (NASDAQ: NFLX) jumped 15.4% in the pre-market session after the company reported impressive fourth-quarter results, which blew past analysts' global streaming paid memberships expectations, with a strong net add figure (18.9 million vs. estimates of 9.8 million). This led to a revenue and EPS beat in the quarter. Additionally, revenue guidance for 2025 beat expectations, and the company spoke optimistically about multiple vectors such as ad revenue, live e","https://finance.yahoo.com/news/netflix-nflx-stock-trades-why-164407203.html","NFLX","NFLX"
